<?xml version="1.0" encoding="UTF-8" ?>
<assembly
	xmlns="https://raw.githubusercontent.com/moriarty/mas-mas/master/rockin.assembly.xsd"
	xmlns:xsi="http://www.w3.org/2001/XMLSchema-instance"
	xsi:schemaLocation="https://raw.githubusercontent.com/moriarty/mas-mas/master/rockin.assembly.xsd https://raw.githubusercontent.com/moriarty/mas-mas/master/rockin.assembly.xsd">
	<task>
		<action>SCREWING</action>
		<subtasks>
			<task>
				<action>SCREWING</action>
				<subtasks>
					<task>
						<action>SOLDERING</action>
						<subtasks/>
					</task>
					<task>
						<action>PRESSFITTING</action>
						<subtasks/>
					</task>
				</subtasks>
			</task>
			<task>
				<action>SOLDERING</action>
				<subtasks>
					<task>
						<action>SCREWING</action>
						<subtasks/>
					</task>
				</subtasks>
			</task>
			<task>
				<action>PRESSFITTING</action>
				<subtasks/>
			</task>
		</subtasks>
	</task>
</assembly>